{
  "id": "resume-backend-focus",
  "slug": "backend-focus",
  "base_commit_sha": "0000000000000000000000000000000000000000",
  "patches_json_path": "memory/resumes/variants/backend-focus.patch.json",
  "rendered_pdf_path": "memory/resumes/renders/backend-focus.pdf",
  "targeted_domain": "platform",
  "created_at": "2026-04-22T08:00:00Z"
}
